,Adjective,Sentence,Noun
0,"['OUTWARD', 'PERPENDICULAR', 'FRONT']",L TWO HANDED OUTWARD HEEL OF R HAND TO TO ACROSS FACE AND CRANE INTO GROIN WHILE PIVOTING ON R BALL OF FOOT SO IT IS PERPENDICULAR TO L FOOT AND BENDING R KNEE ALMOST TO CRANE INTO GROIN AND UP BODY STRIKING JAW WHILE PULLING L ARM INTO YOUR RAISE UP INTO R FRONT SNAP KICK AND R PALM TO FACE,GROIN
1,"['CIRCULAR', 'CHINESE', 'SOLAR']",R STEP BACK L WITH L OPEN HAND OUTWARD R HALF FIST CIRCULAR HIT INTO MID R CHINESE FIST TO SOLAR R PHOENIX TO OPPONENTS L EYE,PHOENIX
2,"['OUTWARD', 'SOLAR', 'CHINESE']",R L OUTWARD R STEP INTO L R HAMMER FIST TO SOLAR R HAMMER FIST TO BASE OF CHINESE FIST TO UNDER CHINESE FIST ACROSS EYES AND FULL CIRCLE TO CHIN WHILE GOING INTO CAT DOUBLE GOUGE EYES WITH CHINESE FIST,CIRCLE
3,"['PARALLEL', 'SCOOP', 'CLOSE']",R PUNCH R LEG L L INWARD R CATCH R STEP PAST SO YOUR L HIP IS PARALLEL WITH HIS R R HEEL SCOOP TO R SHOOT OUT R L SHUFFLE DROP R KNEE ON R PUNCH R POKE L STEP UP INTO CLOSE,INWARD
4,"['RIGHT', 'FRONT', 'SCOOP']",COMBINATION RIGHT PUNCH AND RIGHT FRONT SNAP STEP BACK INTO HORSE WITH L SPLIT HARD L HAND R HAND BOTH HANDS R SCOOP KICK TO R SIDE KICK TO STANDING TURN TO L AND PLANT INTO A HORSE,HANDS
5,"['RIGHT', 'OUTWARD', 'SOLAR']",RIGHT STEP IN WITH R FOOT WHILE BREAKING ATTACKER HOLD WITH L OUTWARD OPEN R PUNCH TO SOLAR R KNEE TO AS ATTACKER BENDS OVER MEET HIS CHIN WITH R THRUSTING UPWARD THEN R KNIFE EDGE HAND INTO REMAIN IN L COVER,REMAIN
6,"['RIGHT', 'DOWNWARD', 'LOWER']",RIGHT R R DOWNWARD INWARD OPEN HAND R 45 TO L SPINNING HOOK KICK TO LOWER TOUCH DOWN 90 DEGREES TO THE,INWARD
7,"['RIGHT', 'OUTWARD', 'SOLAR']",RIGHT R L OUTWARD R HAND BREAKS THROW ARM TO R HEEL PALM TO R SIDE THRUST TO R BACK KICK TO SOLAR L INTO A ATTENTION,THRUST
8,"['OUTWARD', 'OPPONENT', 'OPPOSITE']",R ROUNDHOUSE STEP IN R L HAND BLOCKING ARM AT TURN WRIST OUTWARD WITH R CHOP TO GRAB BOTH SHOULDERS FOR SLIDE L FOOT UP TO R AND R KNEE INTO PLANT STRAIGHT STEP BACK L FOOT AND SWING OPPONENT INTO WALL WITH WITH R ARM HIGH AND PINNED AGAINST THROAT WITH SIMULTANEOUS R ROUNDHOUSE KNEE INTO STEP BACK L FOOT INTO HORSE WITH BACK TO WALL AND THROW OPPONENT TO GROUND BREAKING HIS R ELBOW OVER YOUR L R FRONT KICK TO R HEEL KICK TO OPPOSITE LANDING WITH R KNEE ON THROAT AND R POKE OT STEP OUT WITH R SIDE KICK TO JAW,THROAT
9,"['OUTWARD', 'DOUBLE', 'DOWNWARD', 'FRONT']",HAND GRAB FROM L STEP IN WITH L FOOT WITH OUTWARD DOUBLE DOWNWARD CHOPS TO COLLAR DOUBLE FLAT PUNCH TO R FRONT SNAP KICK TO R PALM TO FACE,COLLAR
10,"['OUTWARD', 'SPREAD', 'FRONT']",R L OPEN OUTWARD R POKE EYES WITH SPREAD PHOENIX GRAB BOTH HANDS FROM EYES AND SWING ARMS OUTWARD AND AWAY FROM R FRONT SNAP KICK TO STOMACH WHILE HOLDING ARMS AWAY FROM BODY,HANDS
11,"['OUTWARD', 'REVERSE', 'OPPOSITE']",R PIVOT INTO R L OUTWARD STEP IN R WITH REVERSE HAMMER FIST TO R SIDE OF L HAMMER FIST TO L SIDE OF R HAND TO BACK OF NECK FACING AND L CLAW TO FRONT OF FACE AWAY FROM AND RIP IN OPPOSITE DIRECTIONS,FACING
12,"['CLOSED', 'DOWNWARD', 'FRONT', 'SCOOP']",L FRONT STEP BACK INTO L COVER FACING OPPONENT WITH R CLOSED FIST DOWNWARD BLOCK TO L FRONT SNAP KICK TO PLANT R PUNCH TO R KICK TO FORWARD PIVOT AND HEEL SCOOP TO BACK KICK TO BODY,FORWARD
13,"['RIGHT', 'SCOOP', 'OPPOSITE']",RUNNING R L INWARD BLOCK AND TAKE HOLDING ANKLE IN PALM OF L HAND R PALM FIRM ON BRING R HAND OVER AND GRAB STEP BACK INTO HORSE WHILE PULLING HEEL IN AN ARC OVER AND BEYOND YOUR RIGHT LEG AND LET TOP OF HIS FOOT FALL ON YOUR R WRIST STEP FORWARD WITH L FOOT AND SCOOP GROIN WITH HEEL STOMP TOSMALL OF SHUFFLE FORWARD AND CHOP TO EITHER SIDE OF HOLD HEAD DOWN WITH L HAND AND RAKE UPWARD ON FACE WITH R HAND PUNCH TO FACE WITH R HAND THIS CAN ALSO BE DONE WITH THE OPPOSITE HANDS,UPWARD
14,"['SMALL', 'DOUBLE', 'RIGHT']",RIGHT LEFT 45 AND THROW MAN ONE INTO THE FEET OF MAN SMALL SHUFFLE BACK WITH DOUBLE HAND RAKE HAND OVER TO RIGHT SHUFFLE AROUND TO FACE FORWARD,SHUFFLE
15,"['CHINESE', 'SCOOP', 'GROIN']",R WIDE 45 TO R WITH L OUTWARD R CHINESE FIST TO NEAR STEP BETWEEN LEGS WITH R 90 DEGREES TO HIS R FOOT BEHIND IT YOUR R KNEE TAKES OUT HIS R LEAN AWAY TO L BACK HEEL SCOOP TO GROIN R BACK THRUST AWAY,THRUST
16,"['BROKEN', 'OUTWARD', 'SOLAR', 'ACROSS']",R SLASHING BROKEN BEER BOTTLE TO L OUTWARD STEP IN WITH R BACK KNUCKLE TO SOLAR PLEXUS FOLLOWED BY R ELBOW POINT TO SAME L HAND GRAB WRIST R REVERSE HAMMER FIST TO BREAK ELBOW MAKE HIM DROP R ELBOW TO RAISE CHIN R HAMMER FIST L TO ACROSS PIVOT TO L 180 DEGREES R THRUSTING AWAY BACK KICK,KNUCKLE
17,"['OUTWARD', 'RIGHT', 'CLOSE']",TWO HAND CHOKE TO FROM L L FRONT SNAP KICK TO CROTCH PLANT BACK INTO L COVER WITH TWO HAND OUTWARD CIRCLE AROUND BOTH ARMS SNAP ELBOWS PULL YOUR HANDS DOWN ON TOP OF HIS ARMS FLING EACH HAND AWAY FROM GRAB WRISTS BRING BACK IN CROSSING THEM IN FRONT OF YOU WITH YOUR RIGHT HAND NEXT TO YOUR LET GO OF CLOSE FIST AGAIN DOUBLE BACK FIST TO TEMPLES,CROSSING
18,"['DOWNWARD', 'CLOSED', 'LOWER']",L L TO WITH R DOWNWARD CLOSED FIST L ARM IS IN A HIGH BLOCKING POSITION FOR L LEAN TO R WITH R UPPER CUT TO LOWER L GRABS TOP OF HEAD AND PULLS TO L R HAND HEEL HITS INTO CHIN AND PUSH ON THROUGH,UPPER
19,"['SOLAR', 'RIGHT', 'BACKKICK']",Right to the solar Backfist to the right corkscrew punch to the right side kick to the left plant left backkick to the right round kick to the left ribs and spinning left hook kick,Backfist
20,"['RIGHT', 'COUNTER', 'FRONT']",Suppose your opponent executes a right and left corkscrew stepping on each the kempo practioner accepts the force by stepping back from a right cover to a left performing a right inward using the counter force from the block lead into a right outward using the counter force to strike with a right back fist to the the effect is to cause the attackers head to move backward and his midsection the Kempo practioner then slides left leg to right and executes a right front snap kick to the attackers groin,Kempo
21,"['INTERESTING', 'LITTLE', 'POSSIBLE']",One of the most interesting concept of Kempo is to use as little energy as possible to immobilize your opponent,Kempo
22,"['SMALL', 'FAVORITE', 'MARTIAL']",Small circle Jutitsu is my favorite martial art style to illustrate this concept,Jutitsu
23,"['NATURAL', 'BEAUTIFUL', 'PAINFUL', 'SOCIAL']",Combining natural movement with chi makes Kempo extremely beautiful to but painful to Kempo emphasizes a need for social order,Kempo
24,"['STRIKING', 'VERTICAL', 'CHINESE']",Kempo striking weapons are classified as Open hand Open hand spear or finger poke or variations of the hammer strike and vertical punch and corkscrew punches invert hammer tiger palm and dragon leapord or chinese and and head,leapord
25,"['FIRST', 'LIGHT', 'VITAL']",The objective is not to move to the but if forced to the plan a strategy to quickly get to your The first strike in Kempo will usually arrive in one of three a fast and light strike to a vital area followed by a more crushing such a tiger palm,Kempo
26,"['SIMPLIER', 'EFFECTIVE', 'MARTIAL']",Wing Chung was in an to train men for using a simplier more effective method of martial arts seeking to add order to,Chung
27,"['PACIFIST', 'VIOLENT', 'MARTIAL']",1235 the head of the Mitose clan the pacifist teachings of Buddhism but was a grandmaster of and violent martial art which was a combination of that Fu and their Aikjujutsu,Buddhism
28,"['SIMILAR', 'OLDER', 'OTHER']",Ryu Kempo is similar to but much older than Kwon and Jujutsu but there is no other art,Jujutsu
29,"['INTEGER', 'POSITIVE', 'NEGATIVE']",value from the currency value from Blank when the integer part is value from for positive and for negative value from for group for date from a string to a date,Blank
30,"['CURRENT', 'CLEAR', 'UNARCHIVED', 'SELECT', 'NECESSARY', 'CONSISTENT']",of Current Redo database is open but in a Hung determine the current log from alter database clear unarchived group perform a full database the database is closed select from current log sequence recover until cancel enter cancel when the archive equals the log sequence alter database open Unarchived Redo Log you do not have all archived redo logs during you cannot recover because you do not have all the redo necessary to make it consistent,Unarchived
31,"['PRIMARY', 'FOREIGN', 'UNIQUE']",Tables in to create a TABLE INITIAL NEXT to setting up the data Define and create the Define and create the primary key Define and create the foreign key Define and create the Primary and Foreign Key to add a constraint to an Key TABLE ADD CONSTRAINT PRIMARY KEY INDEX 20K NEXT 20K PCTINCREASE Key TABLE ADD key constraint KEY name Indexes in ON 20K NEXT 20K PCTINCREASE UNIQUE is specified the key the index is force to be unique index is assumed to be,UNIQUE
32,"['LARGE', 'SPECIFIC', 'ONLINE', 'PHYSICAL']",a for creating a SNAPSHOT 5 PCTUSED 5M NEXT INDEX 500K NEXT FAST NEXT sysdate 1 from a rollback a rollback of a large rollback ROLLBACK SEGMENT a rollback segment ROLLBACK SEGMENT a rollback segment ROLLBACK SEGMENT a rollback ROLLBACK SEGMENT Transactions to use a specific Rollback TRANSACTION USE ROLLBACK SEGMENT A tablespace can only belong to one Tablespaces can be brought online or Physical data for the tablespace is stored a datafile,Tablespaces
33,"['CONCURRENT', 'INACTIVE', 'SEVERAL']",CREATE PROFILE of Concurrent CPU time measured hundredths of time measured hundredths of time measure in of inactive time in of data of data space in the measured in Roles and Granting Privileges to than granting the same of privileges to several the privileges to a role and the role to a user,Granting
34,"['FIRST', 'NUMERIC', 'LOWER', 'RIGHT', 'SMALLEST', 'LARGER', 'EQUAL', 'LARGEST', 'SMALLER', 'POSITIVE', 'SQUARE']",String returns a char with the first of each word in the numeric position of char2 in length of returns char all lower return a char char1 left pad with remove all leading returns char char1 right pad with remove all trailing returns substring at m for n converts all characters returns the ascii code return a char is the result of char1 and Time add n months to d returns last day of the difference between d1 and round to Number absolute smallest integer larger than equal to cosine e raise to largest value smaller than equal to rounding of value to 1 if positive if square root of tangent of value truncated to Group Average of value for a group of count rows of maximum of all value for groups of minimum of all values for groups of sum of all values for groups of,Average
35,"['NECESSARY', 'INCREMENTAL', 'PARTICULAR']",of Media Media all necessary or incremental backup for the particular incarnation the database being recovered,Media
36,"['PRIMARY', 'STANDBY', 'CURRENT', 'ARCHIVED']",the Standby datafiles for primary the standby database control the primary current online redo archived and control file to the standby the standby standby,Standby
37,"['LARGEST', 'LEAST', 'GERMAN']",Drucker notes while Microsoft was becoming the largest software company as least two print companies were growing as one being German based Bertelsmann Group,Group
38,"['SCIENTIFIC', 'MANUAL', 'HISTORICAL']",Taylors scientific task analysis helped the manual worker acheive historical world class production,Taylors
39,"['MULTINATIONAL', 'INTERESTED', 'COMMUNISTIC']",multinational companies will rush to china more interested by the marketing opportunities than barriers of a communistic government,china
40,"['ASIAN', 'FINANCIAL', 'FOREIGN']",The asian financial crisis may reduce the amount of foreign investment pouring into china,china
41,"['LARGER', 'FINANCIAL', 'LOWER', 'CONVENIENT']",Credit Unions will continue to capture a larger share of the financial services offering free or lower rates than banks and more convenient services,Credit
42,"['REQUIRED', 'NECESSARY', 'BENEFICIAL']",8 Partnership is one way to bring required competencies creating the necessary theme strength to make the relationship beneficial,Partnership
43,"['TREMENDOUS', 'INNOVATIVE', 'EQUAL']",Greshenfeld unleashed a tremendous innovative power equal to the printing press,Greshenfeld
44,"['SMALLER', 'SOPHISTICATED', 'COMPLEX', 'HEURISTIC']",The smaller the components the more sophisticated the and the more complex the logic capacity and the more complex the logic the more acceptance of a machine performing heuristic pattern recognition like a the Turing test,Turing
45,"['PHYSICAL', 'BASIC', 'FRONTAL']",Danylewich demostrate a series of physical resistence basic palm palm finger claws to the eye groin forearm groin and frontal and back elbow strikes,Danylewich
46,"['COMPLETE', 'ADVANCED', 'AFFORDABLE', 'CONSCIOUS']",CYMAIV Financial Management System is a fully complete accounting system with advanced functionality at an affordable CYMAIV Edition is truly the affordable accounting alternative for value conscious NFP organizations,Edition
47,"['NATIVE', 'RIGHT', 'LOCAL', 'CONSISTENT', 'LOGICAL', 'READY', 'SEPARATE', 'CAREFUL', 'AVAILABLE', 'PRACTICAL', 'FUTURE', 'TECHNOLOGICAL', 'LATEST', 'AFFORDABLE']",CYMA IV provides true accounting functionality at a fraction of the cost of competing Windows native mode is from top to developed under Windows and Windows attention to the Windows 98 style The right mouse button pops up a local Screen color and fonts are selected by The Windows 98 look and feel is maintained use of the This innovation allows more information to be presented in a consistent and logical manner without overwhelming the ready straight from the package There are no separate and Careful attention has been paid to file and record locking to make the data available when and where the user needs practical security The system administrator can control user access at the task module company or report will grow with future technological Because CYMAIV is designed exclusively for Windows 98 and Windows NT you can be assured of keeping up to date with the latest operating system affordable CYMAIV is one of the most competitively priced systems available today for the accounting Pentium 166 4,Pentium
48,"['MULTIPLE', 'SINGLE', 'PERSONAL']",Simple Business Accounting may be used for multiple multiple divisions within a single business or for both business and personal accounting,Accounting
49,"['GRAPHIC', 'FLEXIBLE', 'ROBUST']",It features easy to use graphic menus with drill flexible robust reporting as well as ODBC Data Export to Microsoft etc,Microsoft
50,"['POWERFUL', 'ADVANCED', 'UNIQUE']",and powerful Advanced inventory Contact Serialized Dimensional Labour Supplier data Low Works on and terminals and via Complete Onsite Perfect for unique Will customize to suit,Perfect
51,"['OTHER', 'REQUIRED', 'ONLINE', 'AUDIBLE']",and monitor your site Proactively as well as offer them live push custom content and other web and much There are no required and Groopz works on all browsers and Give your visitors the support they want and build increase repeat and watch your online sales Guided Site Instantaneous Customer Visual as well as Audible Private Operator Customer Data Fully Cross Platform Flexible Conversation Dynamic Customizable Interface Frequently Used Response Auto 95 98,Response
52,"['DAILY', 'OPTIONAL', 'REMOTE']",sales and processes analuzes daily traffic includes inventory control generates more than 50 optional remote processing supports most POS peripherals Point of Sale ABS System,Point
53,"['FLEXIBLE', 'MULTIPLE', 'SUPER']",of Day Summary Daily Sales Register Detail Daily Receipts Detail Tracks customer and salesperon Instant inventory Flexible receipt Multiple discount Multiple payment MHz Pentium or 32 MB 100 MB hard disk or VGA or Super VGA Windows 95 or Laser or Inkjet,Inkjet
54,"['EXECUTABLE', 'OPTIONAL', 'UNLIMITED', 'MULTIPLE', 'SINGLE', 'SMALL', 'CUSTOMIZED', 'EASIER', 'SPECIFIC', 'SORTED']",Royalty free in compiled executable 3D with scroll and 3D openGL faster drawing all drawings are performed directly to Windows GDI Series TContour Series TPoint Series scatter with optional 3D TBezier Series new Depth Axis to display labels Series and Ticks for the dimensions in 3D New Back Wall sub component with 3D New Gradient filling styles Titles and Foot now accept the Brush Bitmap property to fill the Depth Axis Labels with and without rotation at design time and run Unlimited multiple axis connected to a single or to many All Axis and can now be moved and stretched to any Center Axis Grid method for all 3D Shadows in Point Series HorizAxis and VertAxis properties can display both Axes positioning of Series Marks option to draw new added points per Pie slices in 2D and 3D supporting Pie grouping small slices into a single Brush Bitmap for customized pattern has a clicked function to return Legend item index under the Series Height property for 3D strip and HorizBar Series can be resized when Zoomed Size Bar Brush Bitmap can be used to fill the points can be customized using the OnGetPointerStyle Shape styles Invert 2D Diag Shapes origin can be expressed in axis values and size expressed in Brush Bitmap for customized pattern Series is easier to use with Auto XZ Allows specific non sorted XYZ Legend now shows the surface palette,Legend
55,"['FLEXIBLE', 'POWERFUL', 'AVAILABLE', 'MEDICAL']",LEADTOOLS gives developers the most flexible and powerful imaging technology available offering imaging technology for color image image format Internet medical database Imaging Common FlashPix screen capture and more,FlashPix
56,"['POWERFUL', 'VISUAL', 'PRIVATE', 'UPDATEABLE']",2000 is a high quality VB components manager featuringextremely powerful import export for code and visual with designer and private wizards integratedin VB and Office an updateable library of more than of VB code,Office
57,"['ADVANCED', 'COMPLETE', 'PRIVATE', 'BRILLIANT', 'SPECIALIZED', 'AUTOMATIC', 'REGULAR']",data organization with advanced dragand drop complete VB components designer preview for documents and ActiveX and retrieves with all the private user controls they depend code by using shared 2000 code browse possibilities through four data and code down to routine in Project Brilliant searches with matches integration in VB and Office through specialized Store VB components to and retrieve components from directly from the IDE with a few mouse import for projects and project text notes and examples for each component stored in a the or example on any and automatic code databases maintenance quality code library containing over 90 components than lines of VB that can be used Library can be easily updated by using Update Package Files are released by AxTools on a regular,AxTools
58,"['LOWER', 'TOTAL', 'TAXABLE']",Gilder encourages support for the Laffer stating that lower capital gain taxes would increase the total taxable revenue,Laffer
59,"['CHIEF', 'SUITABLE', 'AGGREGATE', 'TOTAL', 'FISCAL', 'MONETARY']",Keynes defined the chief role of government to maintain suitable levels of aggregate or total demand by fiscal and monetary policies,Keynes
60,"['ORDINAL', 'TOTAL', 'VARIABLE']",name or ordinal the for or Name of the places after the total number of decimal of variable data in of data being value of the data to Parameter a portion of the parameter query string must first be examined before you the number of parameters and data types,Parameter
61,"['REPORTDB', 'REPORTTABLE', 'SELECT']",Obtaining a Visual Basic rsMyRecordset As bPrintReport As Report As app As repView As reportDb As reportTables As reportTable As an select sSQL from rsMyRecordset objConnection,objConnection
62,"['PERSONAL', 'SENIOR', 'GENUINE', 'MARTIAL']",who corresponded with me and acted as intercessor between myself and Thomas Barro Bruce the man who spent the most time and in correspondence with James Mitose during his Nimr the personal senior student prior to and Ramon Lono a genuine master of the martial arts and gentleman who trained with Mitose back in the Hawaii days,Hawaii
63,"['ARISTOCRATIC', 'TYPICAL', 'MODERN']",Motobu was born of an aristocratic Okinawan he could not accept the fact that he was to be treated like a a typical problem among many no longer aristocratic families of after the start of the Meiji Restoration and into modern times,Restoration
64,"['GREAT', 'MARTIAL', 'GENUINE']",Motobu began teaching in he was readily accepted as a great martial arts master by many who treated him with the respect he deserved as a genuine master teacher,Motobu
65,"['OTHER', 'MARTIAL', 'CONFIDENT']",reputation has been maligned by people of other martial arts but by those who knew him Tatsuo Yasuhiro and Kosei he was regarded as a yet supremely confident martial arts master,Kosei
66,"['EARLY', 'POSSIBLE', 'RESPECTABLE']",Motobu tried to immigrate to Hawaii in the early it is possible that Mitose knew that Motobu was not considered a respectable citizen by immigrations and did not want to totally associate his art with Motobu due to that fact,Motobu
67,"['SECOND', 'SHAOLIN', 'CHINESE', 'IMPOSSIBLE', 'VIOLENT']",second reason Mitose wanted his art to be considered Shorinji that is Shaolin martial is so that there would be a Chinese not a Japanese which would have been impossible to teach during the violent times of World War II,World
68,"['AMERICAN', 'SIMILAR', 'CHINESE']",Even combat manuals such as FM Unarmed Defense for the American Soldier tells a similar dealing with Chinese monks and the development of Jujutsu,Jujutsu
69,"['AWARE', 'DIRECT', 'MARTIAL']",would have been aware of this attitude and the history of these thus he created a that used this ideal and contained the truth that his Okinawan training actually did have a direct lineage back to Shorinji monks and the martial arts that developed through them and were modified by his meaning the martial arts masters before even though they were actually Motobu rather than Mitose,Mitose
70,"['FAMOUS', 'GREATEST', 'MARTIAL', 'ALIVE']",the story goes that on a trip back to Choki told his brother how famous he was on the and how he was considered the greatest martial artist alive by the Japanese,Japanese
71,"['RECOGNIZABLE', 'ADVANCED', 'MARTIAL']",art did include techniques easily recognizable to those of advanced skills in both Ninjutsu and Aiki related martial arts,Ninjutsu
72,"['EARLY', 'VERBAL', 'SUPERIOR']",students from the Hawaii from the early and even those who received his verbal instruction at the have superior skills from having been taught by Mitose,Mitose
73,"['TRADITIONAL', 'JAPANESE', 'MEDICINAL']",Mitose used traditional Japanese medicinal methods to treat a condition of Mrs,Mitose
74,"['SEVERE', 'GUILTY', 'RELATED']",were seven points to the with the most severe one being a charge of perjury in regard to testimony and hearsay by people who believed that Mitose was guilty of extortion or such related activities,Mitose
75,"['MARTIAL', 'ACTUAL', 'FORMAL']",then allows a practitioner of the martial art to defend against an actual What is the difference between a practitioner of the martial arts and what we would call a The attribute might be in the formal language of Busan,Busan
76,"['MARTIAL', 'COMMON', 'ACCURATE', 'SECOND']",In some schools of martial arts this is called by common Takeumu or in less accurate unless the second Kanji is Takemusu,Takemusu
77,"['ANCIENT', 'LEAST', 'OLDEST', 'EXTANT', 'JAPANESE']",The concept of Jiyu Kata is an ancient principle which can at the very least be traced back to the oldest extant system of Japanese martial the Tenshin Shoden Katori Shinto Ryu,Shinto
78,"['MARTIAL', 'TWELFTH', 'NECESSARY', 'ACTUAL']",The Daito Ryu and Motobu Ryu of Japan and both which are derived from the Minamoto martial arts of the twelfth have always used free style along with technique training to develop the spontaneity necessary for actual combat or self defense,defense
79,"['OUTWARD', 'RIGHT', 'VERTICAL', 'SOLAR']",Left punch Outward Right shuffle Left vertical the solar Left heel of the hand and claw from the left side of the Right hammer to the side of the The left punch increases in power as the weight of the body moves behind the punch,Right
80,"['SECOND', 'FIRST', 'THIRD', 'FOURTH']",the top labels lblcheck Right Red Check Old Style Bold Outline Black 4 the second label from the top and edit its to the lblto Right Blue To Univers Light Yellow 5 the Bottom label and edit its Comic Sans MS 6 four Command buttons under the labels and text the first command button and change cmdok 0 the Second command button and change Clears the text 1 the Third command button and change Resets colors in textbox to a default cmdResetColors Colors 2 the Fourth command button and change Unloads the cmdCancel 3 Click on your Cancel command button,Cancel
81,"['OTHER', 'EMBITTERED', 'ANGRY']",Landon on the other hand is a kid with a chip on his embittered from his father abandonment of the he is angry at the world,Landon
82,"['GREAT', 'MARTIAL', 'SUPERB']",If your a great martial artist make the journey and share ensights that will help you maintain superb Marital Art skill through out your life,Marital
83,"['ORIGINAL', 'EMOTIONAL', 'NECESSARY']",The authors authors original emotional competencies Social and Relationship Management with these competencies helped us measure the quality of but does not necessary describe how to improve a leader,Management
84,"['POPULAR', 'AVERAGE', 'PHENOMENIAL']",To remain popular Jamal maintains average class room test scores but his intelligence test scores reveal phenomenial intelligence to everyones surprise,Jamal
85,"['YOUNG', 'BLACK', 'HISTORICAL']",Jamal defiance surrounding a young black boy stereotype painting him as this annoys him as so he humilates the owner of a BMW with historical BMW triva,Jamal
86,"['SHORT', 'SPATIAL', 'GROSS', 'HIGHER']",of the weakness Levine addresses are short term memory sequencing spatial gross motor higher word and grammer and when a mind falls behind,Levine
