,Adjective,Sentence,Noun
278,"['CURIOUS', 'PECULIAR', 'ANCIENT']",who are curious might also wish to give some thought to the peculiar garments that the High priests of ancient Israel wore when they approached the Ark,Israel
279,"['MIGHTY', 'UTTER', 'GREAT']",Who will save us from the power of his mighty But take courage and be or you will become slaves to the men and was joined to the utter astonishment of all was and they fled every man into his and there was a very great for there fell of Israel thirty thousand footmen,Israel
280,"['SEATED', 'HORIZONAL', 'TERRESTIAL']",Inside the pyramid are the King Queens and Terrestial Chamber mapped out against a siliquotte it produces an image of a throne with a seated whose feet are horizonal with the terrestial symbolizing a reigning over the 8,Chamber
281,"['HEALTHY', 'ANXIOUS', 'RIGHTEOUS']",The prophet may counsel us to believe in Christ rather than hoist a Brass Serpent to look he may instruct us to attend the he may tell us too continue raising healthy he may encourage us too be anxious engaged in righteous and he may urge us too study more diligently the scriptures,Serpent
282,"['SORROWFUL', 'TROUBLED', 'SECOND', 'SCANTY']",Agriculture was imperiled in North very cool and dry weather in spring and summer hurt our grain fields and it was with sorrowful and troubled hearts that we gathered our second crop of hay and our corn which was so scanty that we repeated only a third of what we usually and wonder how we subsist until next harvest,North
283,"['NUCLEAR', 'LIKELY', 'SURGICAL']",Nuclear weapon usage is likely to be surgical with Mutal assurance deterence from superpowers preventing the machine scenerio,Mutal
284,"['OTHER', 'INANIMATE', 'INCONSISTENT', 'MAGICAL']",did no other prophet including Joseph Smith use inanimate objects too It seems inconsistent too believe the Lord would ask his prophet to create a Brass Serpent for the people look as it had magical powers too heal them,Serpent
285,"['EXTRAORDINARY', 'OLYMPIC', 'SPIRITUAL']",They may have healed through such extraordinary sure they brought praise to Jesus as the source of all healing and did not produce a Olympic spiritual high mark,Jesus
286,"['SPIRITUAL', 'GREATER', 'FAITHFUL', 'VIRTUE']",In some Elijah and Elias are demonstrate Sephraic level spiritual I wonder too what Why show off the power of God to satisfy If Elijah demonstrated power over the universe would the children of Israel believe in any greater know Christ healed the women with blood disease as Christ walked the passages of a faithful women touched his he felt virtue leave and immediately began who had touched him and the women was healed by touching the garment,Christ
287,"['SECRET', 'UNCHALLENGED', 'UNPUNISHED']",slays Abels blood cries up for Cain rejoices in the death of Abel and declares he is Cain gains power of Satan and becomes the Master the Lord asks Cain where is his Cain responds he is not his brothers the Lord curses Cain yet seed continues to survive even through the the secret combinations allow and rapine too go unchallenged and unpunished by establishing promises not to interfer,Master
288,"['LOCAL', 'PERILOUS', 'ADDITIONAL', 'ENOUGH']",Julius broke passage from the port of Caesarea on a local Adramyttium vessel load with the grain provided bonuses because of food shortages in Roman and represented risk taking on perilous seas to capture the it was autumn and the weather patterns were the vessel was some one hundred and eighty feet in contained a sail four and additional two on the carrying enough grain too feed every mouth in Athens for a year,Athens
289,"['VIOLENT', 'ABOUT', 'NORTH', 'MONSTEROUS', 'THIRD', 'MARITIME']",clouds spilled over the mountain peaks of and they knew a a violent norteaster was about to hit superstition and fear filled the mariners ignoring reason they plowed into the violent the full force of the gale blasted the they were driven away from the island of Crete and the wind drove added horror struck the sailors as they realized the gale winds were blowing them southwest into the direction of the dreaded Gulf of on the north coast of Africia the Euroclydon whipped the Mediterranean water into monsterous risking the threat of sinking the crew began dumping items into the sea on the third day the and maritime equipment went overboard the storm was so bad that for many days no light from the or moon was seen,Mediterranean
290,"['STRONG', 'LEAST', 'LIKELY', 'SHALLOW', 'USUAL']",discovered these depths corresponded to the water depths of St Thomas Bay in Munxar reef matched the description of two seas meeting at the reef causing hugh walls of water waves out a few miles from shore with strong currents foaming like a giant observing a bay with a beach the crew decided to run the ship ashore if a least likely chance Paul implores the men to take food and then they dump the grain lightening the ship they let four anchors go into the at Munxar reef two more anchors are dropped in shallow water of thirty the waters are destroying the boat destroying the so they cut the anchors the usual order of the Romans in such a situation was kill all the Julius wants to spare life and commands all who can swim too swim to shore,Julius
291,"['DECISIVE', 'EARLY', 'YOUNG']",experiences of Ender Wiggins hallmarks the strategy concepts surrounding decisive warfare through out the book Ender wins against the and the early in young ender learns how to circumstances of killing were observed by the I,Ender
292,"['GREAT', 'POLITICAL', 'MODERATE', 'COMMON']",Locke and Demosthenes are recognized as great political writers controlling the minds of people of the Locke supports the Warsaw pact and Demosthene a moderate view appealing to the common man for the war,Demosthene
293,"['FIRST', 'HELPLESS', 'COLLECTIVE', 'USELESS', 'EVENTUAL']",Ender learns from Maser Rankham the first bugger victory came when Rankam surprised the buggers by attacking the queen apparently the bugger never thought such an attempt could be done and once the queen was dead the drones were helpless because the collective mind links were useless and so they eventual all died,Rankam
294,"['POPULAR', 'RESPONSIBLE', 'BLACK', 'AWEFUL']",love is not popular did not father more than one black the nephew was responsible for shiring black descendants the Shoulders of by Elder Packer suggests need to wake and realize their aweful predicament,Packer
295,"['YOUNGER', 'HEAVANLY', 'SPIRITUAL', 'GREAT']",the younger explained the process of He was called to repentance by an the words of the angel caused him to be racked for his sins and Alma realized he had rebelled against Alma realized he had not kept the commands of Alma realized he had lead many of Heavanly children down the path of Lucifer causing many children to be lead away into spiritual the thought of coming unto God racked his soul of Alma has a remorse of conscience and calls upon Christ to forgive him of his transgressions the pain of Justice is removed and he remembers the pain no Alma remembers the long suffering of the his great kindness and and the greatness of the Lord and is filled with Great Joy,Great
296,"['PRIMARY', 'ENDLESS', 'FALLEN', 'ETERNAL']",Benjamin tells the people the consequence of as the primary consequence being as the withdrawal of the Spirit of the Lord producing a lack of and Benjamin at this point the people have come into rebellion with Benjamin tells the people that the demands of Justice do remind them of their sense of Benjamin describes the endless torment of those who fight against God or his people of Benjamin talks of the coming of Jesus Christ and the purpose of the the people fall down in fear of the Lord because they realize their fallen they cry for the atoning blood of Christ that they might receive forgiveness and gain a purified a purified heart to see God and gain their eternal the people receive a remission of their sins and peace of Mosiah will not have a mind to injure one another but to live and the people declare that the spirit of the Lord has worked a might change in them or in their hearts and they no longer have a desire to do evil,Mosiah
297,"['ESOTERIC', 'MARTIAL', 'SECRET', 'UPPER', 'HISTORICAL', 'NECESSARY', 'MILITARY']",Knowledge of more esoteric aspects of the martial arts has been kept secret from the general so those in the upper ranks can maintain their position of Historical developments in the western of Japan in the it necessary for the nation to move beyond the martial arts as part of its military culture,Japan
298,"['NATIONAL', 'UNCONSTITUTIONAL', 'LIBERAL', 'UNACCOUNTABLE']",Individuals need to contact their State and National representatives and voice their concern about laws and regulations that both unconstitutional and allow liberal content too go unaccountable,State
299,"['FIRST', 'FUNDAMENTAL', 'EQUAL', 'CROSS', 'SPEEDY', 'SERIOUS', 'REASONABLE', 'CRUEL', 'USUAL']",The first eight were written by Madison too protect fundamental rights of the freedom of right to own due process of the equal protection of the a fair protection against self habeas right to too cross examine their a speedy a right to a jury when serious charges a reasonable protection against cruel and usual and narrowly defined interpretation and application of treason,Madison
300,"['NUMEROUS', 'SIMILAR', 'LOCAL', 'REPRESENTATIVE']",The Anglo Saxons learned Latin and studied the bible and recognized numerous elements of the Law of Mose similar to their own such local governments of 10 families and 100 families and a representative government,Latin
301,"['SMARTEST', 'IMPOSSIBLE', 'CORRUPT']",How did smartest guys on Wall Street How did the impossible Rupiah dropped 85 percent as currency traders forced devaluation revealing a corrupt banking practices and overextension of bad volatility rose to 27 percent,Rupiah
302,"['BETTER', 'HYPER', 'AGGRESSIVE']",Did Belden greed cloud his better judgement and was a leader of a group of hyper aggressive West Cost electricity traders,Belden
303,"['HOURLY', 'PREVIOUS', 'SECOND']",created two the California Power Exchange whose job was to set hourly prices for electricity through auctions conducted on the previous day and on the day of the second agency called the Independent System Operator whose job was too manage the states transmission lines to ensure reliability,Operator
304,"['INTERNAL', 'INSUFFICIENT', 'ABUSIVE', 'PROFITABLE']",deregulation failed in it would harm Enron and the economics of supply and demand encouraged internal criticism of the insufficient number of power plants resulting from power being bought out from California and then resold and abusive manipulations of the market to create profitable margins,California
305,"['SINFUL', 'CONTRITE', 'INSTRUMENTAL']",The Holy Ghost manifests that was crucified by sinful men for the sins of the for the remission of sins unto the contrite The Holy Ghost is instrumental in any testimony of Jesus Christ that a man may gain,Christ
306,"['SECOND', 'PUBLIC', 'FEDERAL', 'INTERNAL']",A second source of income came through the sale of public lands and those funds went into the federal treasury to fund the internal improvements,treasury
307,"['CONTRADICTORY', 'STRONG', 'NATIONAL', 'SMALLER']",contradictory in nature to his Adams supported a strong national bank to hold in check the smaller state banks,Adams
308,"['BRITISH', 'AMERICAN', 'EXPANSIONIST', 'INTOLERABLE']",Sam Houston played up British aid and the American expansionist thought it intolerable to have the enemy on American soil,Houston
309,"['SIGNIFICANT', 'POLITICAL', 'INTERESTING', 'ORIGINAL']",In these speculators were Boston who maintained a significant influence on the political machinery and formulate tax policy requiring the citizen to pay tax money used to shed state debt and interesting the notes would be paid back at original issued value,Boston
310,"['NUMEROUS', 'PRIVILEGED', 'POLITICAL']",farmers wanted the state to provide more money for debt the back country was in bad creditors wanted the farmers to pay their debts with hard the court systems had numerous layers and fees and the people felt that it needed restructuring and additionally they wanted the state constitution to be revised or a new constitution the people questioned why there was a state senate claiming the existing senate was a bastion for the privileged of Boston and the political machinery being influence by the merchants to pay back the war debt,Boston
311,"['UPPER', 'GENERAL', 'PRIVILEGED']",The people was the abolishment of the upper house of the state they did not like the senate in general believing it to be a bastion for the privileged of Boston,Boston
312,"['ALARMED', 'ARMED', 'ANGRY']",protested at courts throughout the state and alarmed authorities as they watched insurgents block the Middlesex County Court receiving no militia David Cobb gain advantage by getting a jump on the insurgents at Taunton protecting the court against 50 armed and 150 insurgents but being forced to adjourn until be shocked John J at Great Barrington lost 800 out of 1000 military after the men voted to abandon the and increase in as Chief Justice William Cushing facing angry farmers,Cushing
313,"['RACIAL', 'BROWN', 'ECONOMIC']",The racial discrimination protection provided in Brown verse the Board of Education was wrongly applied to economic equality for education,Education
314,"['SAUDI', 'DIRECT', 'TERRORIST']",Saudi government is no the Saudis had any direct involvement in carrying out the terrorist attacks of,Saudis
315,"['NECESSARY', 'SAUDI', 'SUSPECT']",The Ads were necessary to ensure the perception Saudi was not directly involved considering the fact 15 of the 19 hijackers were Saudi Nationals and of the suspect terrorist were Saudi Nationals,Nationals
316,"['FIRST', 'ISLAMIC', 'OTHER']",The first wave was the Islamic idea of Jihad as military which broke Islam by legalizing Jihad against other Muslims,Muslims
317,"['SECOND', 'MODERN', 'SAUDI']",The second wave was the Ikwan formation in Nadji settlement funded by Saudi Ibn Saud of the Modern Saudi State,State
318,"['RADICAL', 'SIXTH', 'DISTURBING']",radical faction of Islam called Wahhabism added a sixth and disturbing pillar called the Holy war,Wahhabism
319,"['MOVEABLE', 'SHELVING', 'INDUSTRIAL', 'COMPACT', 'OTHER']",Business Systems distributes Montel high density shelving storage systems in Southern California including moveable shelving industrial compact shelving systems for pallet racking Smartshelf Hybrid Shelving weapon museum storage art panels and art evidence media and tape vaults and many other storage applications,Shelving
320,"['FINANCIAL', 'IRAQI', 'NUCLEAR']",America of Credit and Commerce International Kamal Adham facilitated financial transaction to aid Iraqi smuggling of parts for its nuclear weapons program,Adham
321,"['ISRAELI', 'IRAQI', 'NUCLEAR']",Israeli warplanes surgically struck an Iraqi main reactor at Osirak putting Iraqi back ten years in its nuclear weapons program,Iraqi
322,"['PROHIBITIVE', 'UNLIMITED', 'NATIONAL']",Security Council 687 mandated Iraq disclose a report of all weapons of mass it restricted states from importing Iraq oil until inspectors had determined all prohibitive materials had been it gave inspectors unlimited access to all and it helped inspectors find sites through links from the national intelligence agencies,Council
323,"['OFFENSIVE', 'BIOLOGICAL', 'READY']",Kammel took an offensive posture putting biological weapons placed for ready use,Kammel
324,"['CAPABLE', 'BIOLOGICAL', 'CHEMICAL']",By Secretary of Defense William Cohen said Iraq had rebuilt its infrastructure and Iraq was capable of producing biological and chemical weapons,Cohen
325,"['POLITICAL', 'FOREIGN', 'DEEPER', 'CIVIL']",Diversification will be limited because of political disruption and constitution bans foreign investments in Venezuela president Hugo Chavez opposes deeper American and Columbia is in a civil all and limiting oil export capability,Columbia
326,"['MIDDLE', 'MILITARY', 'ADDITIONAL', 'SAUDI']",Einsenhower doctrine stated that congress authorized the President combat forces to defend the Middle 1957 Saudi received a boost in military assistance for its Army and Air Force plus additional consignments of weapons and strengthening the Saudi Arabian National Guard,Guard
327,"['OBJECTIVE', 'TANGIBLE', 'ANTIC']",Wealth groups buy gold as an objective tangible that continues to appreciate in value old antic rare Chinese and jade,Chinese
328,"['PROVEN', 'POSSIBLE', 'CUBIC', 'NATURAL']",Resource and Uzebekistan statistically have 18 to 35 billion oil barrels in proven reserves and the possible reserves of 235 billion barrels and 236 to 337 trillion cubic feet of natural gas,Uzebekistan
329,"['MUSLIM', 'EXTREMIST', 'RUSSIAN']",Tension in Chechnya and Dagestan from Muslim extremist revolts will destabilize oil through Russian regions,Dagestan
330,"['ADJUSTABLE', 'UPPER', 'AUTOMATIC', 'RETRACTABLE', 'SEVERE']",features seat back recliner adjustment Recliner adjustment adjustable lumbar support controls at seat front on and easy off upper back wide automatic retractable seatbelts with minimized cinching Link Air new Toggle Link Air Suspension has been in the most severe applications,Suspension
331,"['FOREIGN', 'TOUGH', 'MILITARY']",Foreign policy after WWI aimed at building strength in Europe first then Asia and getting tough with Russia meant big military spending and when Truman was perceived to be soft on the his popularity dropped to,Truman
332,"['CAPABLE', 'ALARMED', 'AMERICAN', 'PANDEMIC']",This meant a showdown with Stalin and his declaration that the Soviets were more capable alarmed American in the pandemic fear of WWIII,WWIII
333,"['ATOMIC', 'AMERICAN', 'MILITARY', 'POLITICAL']",It was thought that when the Soviets had the capability to deliver atomic weapon on American soil they would step up their military and political pressure with Europe,Europe
334,"['FOREIGN', 'PERMANENT', 'MILITARY', 'POLITICAL', 'IMPORTANT']",S foreign policy of permanent mobilization correlated to increased military spending moving from to permanent high and political recognition of the important role the House of Representative approving military appropriation bills,Representative
335,"['MORAL', 'FIRST', 'ACCEPTABLE']",moral question of first strike was not acceptable too many Americans,Americans
336,"['NUCLEAR', 'UNREADY', 'MAJOR']",Truman feared nuclear escalation with Russia and China and furthermore the nation was unready for a major land war with China,China
337,"['MILITARY', 'POLITICAL', 'ECONOMIC']",S military push in the Pacific reflects the growing political and economic importance in the Pacific Basin,Basin
338,"['NUCLEAR', 'MINIMAL', 'NECESSARY']",doctrine limit nuclear warfare to a theater region and once engaged diplomatically terminated ending the conflict minimal but necessary to protect the interests of the United States,States
339,"['RUSSIAN', 'ECONOMIC', 'POLITICAL', 'FOREIGN']",Russia was slow to adopt an environment of China seemed to be faster accepting the benefits of the free Russian politics and economic and political corruption inhibit foreign investment and both the economic and political environment in Russia presents a real concern to the future,Russia
340,"['MASSIVE', 'UNBEARABLE', 'OTHER', 'MODERN']",S economy struck suddenly as a result of two earthquakes causing massive damage and forced unbearable costs to rebuild the destroyed oil prices in 1990 Desert Storm caused warfare in the desert with armies racing toward each other in the modern cities crumbled under the weight of warfare,Storm
341,"['BIOLOGICAL', 'HUMAN', 'IRANIAN', 'RICHEST', 'CAPABLE', 'PERSONAL', 'MEDICAL', 'PROGRAMMABLE', 'CHRONIC', 'GOVERNMENTAL']",Biological engineers from the Middle East created a biological weapon that could be used in the manufacturing of computer this increased the use of computer chips in all facets of human the Iranian inventor became one of the richest men in the he begins to think of himself as new chip designed were capable of being inserted under the skin contain all personal such work medical and disease the chips were programmable to shorten life for people with chronic and if one did not accept the chip they were considered an outcast and forfeited access too any governmental support programs like welfare and medical care,Middle
342,"['IMMEDIATE', 'SIGNIFICANT', 'CONGRESSIONAL']",The immediate adoption of the Patriot Act without significant congressional a huge increase in President war powers to punish enemies of the U,President
343,"['FOREIGN', 'HIGHER', 'MASSIVE', 'ECONOMIC', 'MEDIUM', 'SMALL']",The North American Free Trade Agreement destruction of any protection from foreign competition the result is Higher profits for Mega corporations and massive economic collapse for medium and small businesses,Agreement
344,"['SMALL', 'OBSERVABLE', 'LARGE']",Quanta are so small they are not observable in the large scale world,Quanta
345,"['CLASSIC', 'MATHEMATIC', 'CAPABLE', 'EXACT']",an attempt to defend classic Schrodinger constructed a mathematic wave equation capable of matching the exact calculations by Pauli and matrix quantum theory,Pauli
346,"['DEFINITE', 'PHYSICAL', 'INCOMPLETE']",Both position and velocity are of that have a definite physical existence and the Heinsburg uncertainty principle can not account for the theory is incomplete,Heinsburg
347,"['SERIAL', 'FIRST', 'DIRTY', 'BLACK', 'WRONG', 'RIGHT']",does not die in the warehouse John manages to find a grain slide and escape down it into the bay John loves his wive and wants to see her John visits his a at the if he had she would not have been at the a result she saves a serial killers John Jr realizes the past has changed an made the future Jack in the future increased his killings from three to John Jr tells his father they must stop the killer to save the John Jr discovers that the killer Jack killed his mother a John Jr discloses the address and name of the first John is discovered by Jack and loses in a fight with Jack and Jack steals his drivers John uses a finger left by Jack on the finger print is traced to a dirty Jack has been living off disablity and stacking John can not stop Jack and Jack kills the first victim and when John arrives an eye witness places him at the crime John predicts the outcome of the mets game to his black cop wife arrives and the black cop takes her aside to watch the game and tell her John is a suspect in the this gives Jack a chase to question John at gun Jack wants to know how John knows about him and tries to kill John at the police Jack is interrupted by a fellow this give John a chance to improvise a defense using wires from the fuse box and airconditioning John manages to electrocute Jack with the start the fire and manages to John reverse the tide by gaining access to information about residence from information in his Jack discovers John in his apartment and the shooting Jack chases John and they end up fighting in the John takes a steel bolt to Jacks head and it seems Jack is John Jr does not understand why the mothers picture has not been restored and tells John something is wrong when suddenly Jack appears in both time periods and because John had fixed the ham radio his tools were on the desk and because he was John manages to John shoots off Jacks right hand which helps John Jr escape the attack by Jack in the and the best part is everyone made a ton of money off Yahoo,Yahoo
348,"['TRADITIONAL', 'SCIENTIFIC', 'SKILLED']",Shackleton broke down the traditional hierarchies by having the scientist share in the ship chores and having seaman taking scientific readings with the effect being the creation of a group of generalist skilled in all aspects of the ships operations,Shackleton
349,"['INCREDIBLE', 'OTHER', 'CLOSE', 'SIMILAR', 'STEEP', 'WORST', 'LOCAL']",smoke jumper elite were a forbidden their story shows their incredible determination to they lived their on the edge and lives with each other represented a close family the Storm King blowup was similar to the Mann Gulch blowup and no correlation translated to warn against a repeat McKay was a the escape routes were too long and steep with the worst part of the path achieving a 55 degree incline as the blue hat pace dropped to 1 per hour as the fire increased its velocity to 5 miles per Prineville Interagency Hotshot Crew was not briefed on local or fire weather forecasts before being sent to the South Canyon fire,Canyon
350,"['EXTERNAL', 'DISRUPTIVE', 'SILENT']",Who are my external Competitors that are emerging with disruptive technology that will meet the silent needs of my customers,Competitors
351,"['AVAILABLE', 'FINANCIAL', 'SINGLE', 'MASSIVE']",Schwab continues to make available financial advise by agent or 3rd party financial planner and Schwab as a discount broker leverages the single source for customers to purchase mutual thus reducing confusion cause from massive variety,Schwab
352,"['SINGLE', 'FINANCIAL', 'MUTUAL']",Schwab provides the customer a single financial report and gains the brand recognition and prestige of the mutual fund company,Schwab
353,"['NEGATIVE', 'EXTREME', 'INTENSIVE', 'FINANCIAL']",Why would this fact be The negative risk factor suggested extreme exposure for Trump because the investment was an asset intensive liability and in a negative financial fatal,Trump
354,"['ECONOMIC', 'MASSIVE', 'POSSIBLE']",What would be the odds that Manhattan Real Estate would drop in If Real Estate prices dropped caused by economic downturns or market reversal trends and would lead too massive on the creditors would be forced to liquidate the as long the creditors did not call this debts survival was possible,Estate
