,Adjective,Sentence,Noun
848,"['POTENTIAL', 'FINANCIAL', 'CATASTROPHIC', 'MUNICIPAL']",Potential financial catastrophic events in the derivatives and Municipal bonds or Financial collapse of Citigroup or Bank of America,America
849,"['NEURAL', 'NEWBORN', 'MAJOR']",In his Synder injected the neural stem cells into the brains of newborn mice and confirmed that the cells develop into neurons and the two major classes of brain cells,Synder
850,"['NEURAL', 'DRAMATIC', 'FUNCTIONAL']",In an injection of neural stem cells in the brains of Parkinson Monkeys Green led to a dramatic functional recovery,Green
851,"['SUCCESSFUL', 'ECONOMIC', 'RAPID', 'MODERATE']",Czech and Poland have been successful in economic with rapid output and moderate inflation,Poland
852,"['VIOLENT', 'POLITICAL', 'FOREIGN']",Mexico violent political development forced the withdrawal of foreign capital,Mexico
853,"['ALIEN', 'NUCLEAR', 'INTERPLANETARY']",Kaltu tells the alien civilization have been watching earth and discovered breakthroughs in earth nuclear energy and soon interplanetary travel which will threaten the universe,Kaltu
854,"['ELECTROMAGNETIC', 'ELECTRIC', 'GENERAL']",existence of a radiation impedance for the electromagnetic radiation from an oscillating charge is show to imply a fluctuating electric field in the and application of the general theorem yields the Planck radiation law,Planck
855,"['UNIQUE', 'FLAVORED', 'POPULAR']",Andrew had created a unique flavored Whiskey and it became popular,Whiskey
856,"['FEDERALIST', 'FINANCIAL', 'COMMON']",Federalist financial management would be in the banking experiment the National bank no common and economy in ruin,National
857,"['DELICATE', 'YELLOW', 'ELECTRIC', 'EMOTIONAL']",Colors of red overall energizing no delicate increase blood yellow tissue wound Orange Green Blue or reducing pain relieving Violet and electric violet and energizing emotional,Violet
858,"['IRRITABLE', 'SOLAR', 'LIGHT', 'WHITISH']",Irritable Bowel solar plexus sweep with light whitish green,Bowel
859,"['EQUIVALENT', 'UNITARIAN', 'SOCIAL']",Utopia is equivalent to unitarian the unitarian social experiment,unitarian
860,"['ELECTROMAGNETIC', 'EFFECTIVE', 'QUANTUM']",Vedral suggest that this effect is a result of entangled electrons in the surface of the giving the photons of the electromagnetic field effective leaving them struggling through the material as if it were quantum molasses,Vedral
861,"['LIMITLESS', 'REMARKABLE', 'EXCESSIVE']",If the Higgs the God is truly entanglement then combined with entanglement limitless reach and remarkable it seem excessive to call entanglement the God effect,Higgs
862,"['UNINTERRUPTIBLE', 'STANDBY', 'CORPORATE']",The Sure Power offers uninterruptible power batteries and standby diesel generator for corporate data centers as supply power in case of grid power outage,Power
863,"['FIRST', 'RELIABLE', 'OTHER', 'ADVANCED', 'ELECTRONIC']",First National Bank was the first to install the most reliable power source combining fuel cells with other advanced energy and electronic devices,National
864,"['DICTATORIAL', 'REGIONAL', 'SIMILAR', 'JOINT']",Opponents fear the establishment a dictatorial regional government similar too the European Union and the removal of borders and the establishment of a joint perimeter around all three countries,Union
865,"['LARGER', 'COMPETITIVE', 'LATEST']",Japanese compete for larger market share through the introduction of new and more competitive products and by using and improving the latest technologies,Japanese
866,"['WESTERN', 'CHALLENGING', 'JAPANESE', 'EVERYDAY']",praises Western researcher enthusiasm in tackling challenging projects but says they will be at a disadvantage in meeting the Japanese challenge in products if they only concentrate only on the approach and forget everyday Kaizen,Kaizen
867,"['POSSIBLE', 'JOINT', 'VISIBLE', 'HIDDEN']",Each possible joint configuration of the visible and hidden units has a Hopfield energy function,Hopfield
868,"['MECHANICAL', 'CLOSED', 'THERMODYNAMIC']",Entropy is known as a measure of heat energy that be turned into mechanical energy in a closed thermodynamic system is understood as a measure of information,Entropy
869,"['REVERSIBLE', 'USEFUL', 'ORIGINAL']",Why is this Quantum measurements affect the qubits and must be reversible to the initial too be useful original,Quantum
870,"['IMMEDIATE', 'MILITARY', 'LARGE']",Spock does not see the immediate military threat nor does he acknowledge the large loss of life,Spock
871,"['ALIEN', 'EXTREME', 'STRONG', 'STRONGER']",The alien Agorn is a reptile being who is extreme strong but possibly a hundred times stronger,Agorn
872,"['SEVERAL', 'ASIAN', 'GLOBAL']",For several years emerging Asian economies have account for more global GDP growth than America has,America
873,"['ACCUMULATIVE', 'LARGE', 'INTERNATIONAL']",Accumulative earnings from Middle East oil export for 2004 through 2008 will approach 45 percent is adding to large holdings of international reserves,Middle
874,"['VIRTUAL', 'MIXED', 'SIMULATED']",Blake Lebaron at Brandeis University has built a stock market virtual market allowing him to stimulate behaviors of and mixed and then release simulated investors into the environment,University
875,"['FINANCIAL', 'INTERNATIONAL', 'POLITICAL']",Lawrence Summer study of no financial events between 1946 to 1987 demonstrated only nine cases where international or political tensions accounted for market movement,Summer
876,"['VISIBLE', 'OTHER', 'INFERABLE']",Andrei Markov stressed that while some variables are visible in any process or model are other are always through the one you see are inferable from the ones you can,Markov
877,"['THIRD', 'LARGEST', 'CLOSE']",By India will be the third or fourth largest economy in the world with China close on its heels,China
878,"['CHEAP', 'CENTRAL', 'CHAOTIC']",Discovery of chaos required Supercomputers using cheap central processors simulated millions of years motions to reveal chaotic patterns demonstrating the 3 body problem is chaotic,Discovery
879,"['SMALL', 'LARGE', 'ACCUMULATIVE']",Edward Lorenz discovered how small differences in precision sum to large difference in accumulative totals,Lorenz
880,"['FACTUAL', 'CIRCUMSTANTIAL', 'CONCLUSIVE']",Spock lacks factual proof to conclude circumstantial evidence is conclusive evidence,Spock
881,"['COMPLEX', 'SIMPLE', 'FIFTH']",Maxwells complex equations emerge effortlessly as the simple vibrations found in the fifth dimension,Maxwells
882,"['COMPLEX', 'INEVITABLE', 'PERPLEXING']",The gravity surrounding the collapse of the complex Nephite society seems inevitable and perplexing and causes one to ponder about why the Nephites stop the before it happened,Nephites
883,"['SHEER', 'RATIONAL', 'PEACEFUL', 'DELIGHTSOME', 'GROSS', 'FILTHY']",The sheer veracity of the Nephite actions demonstrated no rational and the once peaceful and delightsome people were lost in a gross quagmire of the filthy waters of Hell,Nephite
884,"['JOINT', 'EUROPEAN', 'SUSTAINED']",International Thermonuclear Experimental Reactor a joint venture by European and US will attempt a sustained fusion reaction for of seconds,Reactor
885,"['CONVEX', 'MAGNETIC', 'STABLE']",Polywell Wiffle ball trap of electrons convex magnetic fields stable Hydrogen or and fusing into 3 magnetic grid removes the,Hydrogen
886,"['CHEAP', 'NUCLEAR', 'FRESH', 'PRACTICAL']",Electric Fusion plants can make cheap ethanol replacing burn up nuclear fresh water from the and practical space flight,Fusion
887,"['CLEAR', 'ANNUAL', 'TROPICAL']",is no clear trend in the annual numbers of tropical says Intergovernmental Panel on Climate in 2006,Climate
888,"['GLOBAL', 'TROPICAL', 'SEVERAL']",There is no evidence of a global increase in the strength and frequency of and tropical cyclones over the past several says Dr Christopher Landsea,Landsea
889,"['LIKELY', 'NATURAL', 'CURRENT', 'GLOBAL']",Wingham says the collapse of the ice shelves is more likely to have been driven by natural current fluctuations than by global warming,Wingham
890,"['PRIVATE', 'NATIONAL', 'BETTER']",Private marketed by big national banks and trusted student loan including Sallie are not much better than putting your tuition on a credit card,Sallie
891,"['CONVEX', 'MAGNETIC', 'STABLE']",Polywell Wiffle ball trap of electrons convex magnetic fields stable Hydrogen or and fusing into 3 magnetic grid removes the helium,Hydrogen
892,"['CHEAP', 'NUCLEAR', 'FRESH', 'PRACTICAL']",Electric Fusion plants can make cheap ethanol replacing burn up nuclear fresh water from the and practical space flight,Fusion
893,"['EXTENDED', 'AVAILABLE', 'FEDERAL']",Extended repayment plans are available for most federal PLUS and Stanford loans,Stanford
894,"['METALLIC', 'RAPID', 'METEROLOGIC']",Louis Le Mouel circulation of the metallic fluid is polarized by the rapid rotation of the as is its meterologic circulation,Mouel
895,"['SMALL', 'LOCAL', 'MARTIAL']",Sakuma opened a small school for local kids to learn Martial Japanese only,Japanese
896,"['FIERCE', 'UPPER', 'LITTLE']",The fighting was fierce and the upper belts did not seek to injury Jonathan but they offered very little sympathy,Jonathan
897,"['INDEPENDANT', 'CURRENT', 'COMPETIVE']",What is the purpose of Management decides the core values of the independant of the current competive or management fads,Management
898,"['EUROPEAN', 'ECONOMIC', 'PARTIAL', 'GLOBAL']",France can not act become of the demands of the European economic integration a partial response to the demands of the global marketplace,France
899,"['LARGE', 'FOREIGN', 'DOMESTIC']",can China attract large amounts of foreign capital without running a large The reason inflows of foreign capital do not create a trade deficit is that they are offset by outflows of domestic capital,China
900,"['CHINESE', 'POLITICAL', 'MILITARY']",Krugman worry as much as anyone about the effects of growing Chinese power in political and military stability,Krugman
901,"['LARGER', 'SMALLER', 'OTHER']",The US will make up for its trade deficit with China by running larger surpluses or smaller deficits with other countries,China
902,"['COMPETITIVE', 'FLEXIBLE', 'LIMITED', 'CONSISTENT']",Paul Krugman highly competitive and flexible labor markets made room for all the new entrants and limited wage increases to rates consistent with our slow productivity growth,Krugman
903,"['POSITRONIC', 'FIRST', 'POSSIBLE']",Leebig had modified the positronic Robot testimony can not be used as the modified robots could break the first law of for example the poison arrow aim at Baley and the poison drink that injured Security Head the injury summoned concern that a robot rebellion possible,Security
904,"['CAPABLE', 'PERMANENT', 'POSITRONIC']",The Robot at the murder scene was not capable of stopping the murder and the murder cause a permanent seizure of his positronic brain,Robot
905,"['OTHER', 'COMPLETE', 'IMMERSIVE']",Most Solarians view each other using the tridimensional a complete immersive reality,Solarians
906,"['BEAUTIFUL', 'AWESOME', 'PROMISING']",Thomas is an MIT self made and enjoying the good a beautiful an awesome and a promising business,Thomas
907,"['RATIONAL', 'ENOUGH', 'FIRST']",Self defense rational was a high enough reason too forfeit the first three law of Robotics,Robotics
908,"['UPWARD', 'RIGHT', 'VERTICAL']",The knife went to head height and Emilie follow with a left upward crane and finished with a right vertical punch to the bridge of the nose,Emilie
909,"['RIGHT', 'DOWNWARD', 'PERFECT', 'NINJA']",Emilie blocked the wheel kick with a right downward block and execute a perfect left wheel kick to the right side of the Ninja neck,Emilie
910,"['REDEMPTIVE', 'BROKEN', 'CONTRITE']",Hiro thought to Japan needs to find a redemptive but what is Jesus Christ taught that man must offer a broken heart and contrite spirit,Christ
911,"['FIRST', 'COSMIC', 'BLACK']",The Time Lords violate their first rule and bring a Doctor from the past to assist the doctor in the present to fix the cosmic drain caused by the black hole,Lords
912,"['INCLUSIVE', 'USELESS', 'IMPOSSIBLE']",Pride and all inclusive claim of success makes an assertation that meaning of the question is useless and impossible,Pride
913,"['FASTER', 'QUICKER', 'SMARTER']",Write sPhrase MORE sPhrase MOST sPhrase WHY sPhrase FASTER sPhrase QUICKER sPhrase CHEAPER sPhrase SMARTER sPhrase IMPORTANT sPhrase WELL sPhrase SEEK sPhrase LEARN sPhrase COMPREHEND sPhrase STUDY sPhrase DISCOVER sPhrase CONTEMPLATE sPhrase TELL sPhrase REQUIRE sPhrase NEED sPhrase SUMMON sPhrase INQUIRE sPhrase PREDICT sPhrase ESTIMATE sPhrase FORCAST sPhrase UNDERSTOOD sPhrase DETERMINE sPhrase HELP sPhrase INSERT sPhrase ACQUIRE sPhrase ACQUIRING sPhrase ATTEND sPhrase CAUSES sPhrase PRODUCES sPhrase YIELDS sPhrase RESULTS sPhrase PROBLEM sPhrase PROBLEMS sPhrase BEHAVIOR sPhrase HISTORY sPhrase THINGS sPhrase COMMENT sPhrase COMMENTS sPhrase IT sPhrase ITS sPhrase I sPhrase WE sPhrase HE sPhrase HIM sPhrase SHE sPhrase HER sPhrase YOU sPhrase THEY sPhrase THEM sPhrase THEIR sPhrase ME sPhrase MINE sPhrase US,sPhrase
914,"['GRAVITATIONAL', 'OTHER', 'VISIBLE', 'FAINT']",The Einstein telescope is using gravitational lens to see other parts of the Universe not previously visible or too faint to be seen,Universe
915,"['SMALL', 'LARGE', 'LIGHT']",The best known of the small galaxies are the Large and small Magellanic Clouds about light years distance,Clouds
916,"['EMPTY', 'GREAT', 'INTERNAL', 'ATMOSPHERIC']",Hydrogen pours between the empty atoms of Palladium and it fills up the metal by some ten percent in all putting it under great internal pressure many thousand times the atmospheric pressure,Palladium
917,"['ELECTRIC', 'SEVERAL', 'ATMOSPHERIC']",The electric voltage forced the hydrogen into the Palladium until the hydrogen was several thousand times the atmospheric pressure,Palladium
918,"['SINGLE', 'GREATEST', 'VULNERABLE']",in the single greatest miscalculation of the MacAuthor decided to go all the way to Yalu because he was sure the Chinese would not come and so made his troops infinitely more vulnerable,Chinese
919,"['POLITICAL', 'REVOLUTIONARY', 'AMERICAN']",believed that political purity and revolutionary spirit of his men greatly outweighted American superior say Halberstam,Halberstam
920,"['CUNNING', 'COURAGEOUS', 'GREAT']",The Chinese were cunning and courageous fighters and fear was the great enemy that had to be,Chinese
921,"['CHINESE', 'LASTING', 'NATIONAL', 'MILITARY', 'INDUSTRIAL']",The Chinese entrance into the war would have a long lasting effect on US national NSC increased Pentagon military industrial fear of the communist and fear of losing the country to communism,Pentagon
922,"['AMERICAN', 'ECONOMIC', 'VITAL']",years after the end of the there are still American troops garrison and the South had become something of an economic beacon to underdeveloped its economy infinitely more vital than that of the Soviet Union itself in the late 1980s,Union
923,"['NORTH', 'BOASTFUL', 'MILITARY', 'CHINESE']",The North Korean had been far to boastful about their military capability and it was the Chinese troops that saved them,Korean
924,"['AMERICAN', 'CHONGCHON', 'CHOSIN']",The American troops did not release they were surround and the force build that mounting against chongchon river Singhung escape of Love evacuation from departure from Chosin death at the gauntlet and the battle for Seoul,Seoul
925,"['SPANISH', 'COOPERATIVE', 'LANDLESS']",The Spanish colonization destroyed the cooperative farming of Central America and reduced the natives to landless serfs,America
926,"['INDUSTRIAL', 'FOREIGN', 'PUBLIC']",Ubico Castaneda modernized encouraged industrial increased foreign and instituted public works,Castaneda
927,"['UNUSED', 'AVAILABLE', 'LANDLESS']",Arbenz Guzman attempted to begin a program of land making unused land available to the landless poor,Guzman
928,"['OTHER', 'CENTRAL', 'SPANISH']",Toltecs abandon Toltecs spread into other Toltecs establish Tula as new Toltecs are absorbed by Chichimecs rule the Valley of Aztecs invade the Valley of Aztecs emerge as the dominate Aztecs rule the Valley of Spanish invade central Spanish conquer central,Spanish
929,"['WIDESPREAD', 'SOLAR', 'ACTIVE']",Observations from the Telescope and Imaging Spectrometer instruments aboard Hinode reveal that plasma is widespread in solar active regions,Hinode
930,"['INCREDIBLE', 'FIRST', 'VISUAL']",Everest Disaster by Jon incredible adventure starts with a story by Ed Davis of his first hand visual experience seeing the Ark,Davis
931,"['ANCIENT', 'CRUDE', 'PREHISTORIC']",Davis sees latches and lock ancient oil clay and crude tools and what appear to be prehistoric farm implements,Davis
932,"['EGYPTIAN', 'DIFFERENT', 'ENVIRONMENTAL']",The Egyptian Diety hierarchy seems to describe different environmental realms,Diety
933,"['ANCIENT', 'MINISCULE', 'TOTAL']",In our ancient North America museum in NY we have an iron axe head that was not rusted into oblivion because it was found within a stone This collection is only a very miniscule part of the total amount of artifacts that have been found in these areas,America
934,"['ARCHAEOLOGICAL', 'ADVANCED', 'MANIFEST']",doing it all so that when they were and immediately declared as fakes by the archaeological community at that time were given directives by the Smithsonian Institute to hide or discredit anything showing an advanced civilization in order to conform with the manifest destiny doctrine of the they would receive nothing but scorn from them,Institute
935,"['EXPRESS', 'GEOLOGICAL', 'VIABLE', 'ADVANCED']",Talmage after his was found to have gone out from SLC with the express intent to declare any artifacts he found as fakes and written three days before leaving to go do the He was heavily influenced by his geological background and need to be accepted as a viable geologist by the Smithsonian Institute who was actively trying to squelch anything that would hint of advanced civilization,Institute
936,"['FALSE', 'ANCIENT', 'MODERN', 'INCORRECT']",The false assumption that the ancient had no such tools therefore they are modern day fakes is an incorrect assumption if the Book of Mormon is true,Mormon
937,"['CONTROVERSIAL', 'NECESSARY', 'OVERALL', 'ANCILLARY']",have avoided going into these controversial artifacts in my presentations and DVD simply because of their controversial nature and also because they are not necessary parts of the overall research and information pertaining to the North American but an ancillary part only,American
938,"['EASTERN', 'ANNUAL', 'AGRICULTURAL']",appearance of Sirius on the eastern horizon marked the beginning of the Niles annual inundation and the beginning of the agricultural year,Niles
939,"['SOLAR', 'CLOSER', 'FRIENDLY', 'BIOLOGICAL']",If the solar system were closer to the Galactic bulge the and mass would not be friendly for biological life,Galactic
940,"['UNRIGHTEOUS', 'LATTER', 'GREAT', 'DREADFUL']",Jesus also foretold that his gospel would be that he would suffer under the hands of unrighteous the holy city of Jerusalem would fall to the Jews would be his gospel would be restored at a latter time before the Great and Dreadful day of the Lord,Jerusalem
941,"['HOLISTIC', 'BASIC', 'WHOLE']",Realty must be thought of as holistic because the basic conditions for existence are embodied in the which equals the whole,Realty
942,"['PHYSICAL', 'OBSERVABLE', 'SIMULTANEOUS', 'RECURSIVE']",The Universe freely determines its own constraints and the creation of its physical observable content being effectively and simultaneous and recursive,Universe
943,"['STRONG', 'CORRUPT', 'ECONOMIC']",Palin is very offers strong leadership fights against corrupt politics and and encourages economic growth,Palin
944,"['DOMESTIC', 'CUBIC', 'UNDISCOVERED', 'NATURAL']",Palin said the pipeline could provide domestic energy production for the next ten years with the potential of 100 trillion cubic feet of undiscovered natural gas reserves,Palin
945,"['DIRECT', 'EGYPTIAN', 'ISLAMIC', 'SECRET']",Gabriel questions put him direct conflict with the Egyptian Islamic secret police,Gabriel
946,"['AMERICAN', 'READY', 'UNPREPARED']",Bin Laden have seen in the last decade the decline of the American government and the weakness of the American soldier who is ready to wage Cold War and unprepared to fight long wars,Laden
947,"['COMMUNIST', 'MAJOR', 'SOVIET', 'MILITARY']",Nicaragua was supplying aid to communist guerillas in Guatemala and El Salvador and building a major Soviet military base in the territory,Salvador
948,"['COMMUNIST', 'ARMED', 'ISLAMIC']",The Carter administration stood by as communist insurgencies were being armed in Guatemala and El Salvador and Islamic fundamentalism lead to the 1979 revolution led by Ayatollah Khomeni resulting in the Islamic state,Khomeni
949,"['IMPORTANT', 'FUNDAMENTAL', 'ECCLESIASTICAL']",Freedom of religion is the most important fundamental right and thus jealousy on the subject of ecclesiastical says Justice Story,Story
950,"['SMALL', 'LOCAL', 'BIGGER']",the Milkyway must represent a small local fluctuation away from the equilibrium of the bigger cosmos,Milkyway
951,"['GRAVITATIONAL', 'EQUAL', 'OPPOSITE']",Universe could have started as a singularity where the gravitational field was carrying on an equal and opposite amount of energy,Universe
952,"['SPIRAL', 'CELESTIAL', 'NORTHERN']",Could the Nasca spiral monkey tail represent the revolution of the stars around the celestial The main clearing points to Uras Major in the northern hemisphere aligning with the stars in 710 AD,Major
953,"['RESILIENT', 'STRONGER', 'DISPARATE']",Will America remain resilient during periods of high high government and stronger regulation and Politics and business objectives seem disparate,Politics
954,"['UNCONTROLLABLE', 'POLITICAL', 'MILITARY']",is hyperinflation and how did it affect Hyperinflation is the uncontrollable printing of it is the byproduct of a political machine that lacks confidence and and it results from military campaigns financed by borrowed debt,Hyperinflation
955,"['PUBLIC', 'MASSIVE', 'BURDENSOME']",WWI losses meant in 1918 that Germany possessed huge public debt financed through government massive increases in money and burdensome war reparations percentages,Germany
956,"['STRANGE', 'BOTTOM', 'NEUTRINO']",God charm strange top bottom electron neutrino Muon neutrino electron muon tau neutrino Force Messenger Particles and Z0,Particles
957,"['NEGATIVE', 'POSITIVE', 'NEUTRAL', 'QUARK']",u up d s negative negative uud proton udd uds lambda sigma plus sigma minus uds sigma zero dss xi minus uss xi zero positive pion negative pion neutral positive kaon negative kaon neutral kaon neutral antikaon are three quark combinations,antikaon
958,"['ENOUGH', 'FINANCIAL', 'DISPARATE', 'FEARFUL']",Was lego not make enough products that people Legos financial struggles and disparate product lines made adult fans fearful the company could disappear,Legos
959,"['POSITIVE', 'NEGATIVE', 'SILENT']",The Millennials were born in an era when Americans began expressing more positive attitudes about children rearing and they repaired the negative child rearing perceptions of the boomers and the silent generation,Americans
960,"['ARTIFICIAL', 'VIGOROUS', 'METABOLIC']",The Millennials more controlled lifestyle has confined them to artificial reduced vigorous and lowered their metabolic and isolation has resulted in a lack of maturing immunity systems,Millennials
961,"['FASTEST', 'MAJOR', 'ECONOMIC']",the Millennials are the fastest generation to reach 18 years without a major economic bust,Millennials
962,"['TREMENDOUS', 'MILLENNIAL', 'DISPOSABLE']",The Boomers and Xers have put on a tremendous display of work ethic for their millennial children and plenty of disposable cash to spend,Boomers
963,"['CULTURAL', 'AUTHORATIVE', 'POLITICAL', 'ECONOMIC', 'LARGE', 'PRIVATE', 'PUBLIC', 'ROBUST', 'LIVELY']",By the Millennials will be 40 years old and at the peak of their cultural they will seem authorative and in their political and economic they will launch large private and public projects to improve and they will endorse unionism and corporationism in politics and economics in a robust and lively involvement,Millennials
964,"['SINGLE', 'SYMMETRICAL', 'STRONG']",A single symmetrical force occurs at degrees Kelvin with the weakening of the strong force,Kelvin
965,"['INDIAN', 'FRESH', 'TOTAL']",About 30 Gangorti desalination plants along the coast of Orissa built and subsidized by the Indian government will provide the fresh at 3 million cubic at a total cost of,Orissa
966,"['LARGE', 'YELLOW', 'WHITE', 'CHEAPER', 'AVAILABLE', 'DOMESTIC']",Large increases in prices for yellow corn meant there were places in Mexico where white corn was cheaper and white corn purchases surged creating a shortage of white corn available for domestic food markets,Mexico
967,"['DOMESTIC', 'EXTREME', 'AMERICAN', 'CORPORATE']",In Russia signaled domestic Europe was moving into extreme Islam was at war with the the American education system was in and corporate downsizing practices were working its way into government,Islam
968,"['THIRD', 'CIVIL', 'MEXICAN']",forecast the 1987 stock market Ross Perots emergence of a third civil war in the collapse of the Mexican downsizing of the American Middle the Green marketing growth of home and a surge in fitness and nutrition for the baby boomers,Green
969,"['PRISTINE', 'RIGHTFUL', 'ORIGINAL']",learns from Arvandan about the theory of Earth will be the center of the the empire will be Earth will triumphant in pristine Earth will become the rightful ruler of the and earth was the original home of humanity,Earth
970,"['SMALL', 'MEDIUM', 'SIZED']",Cisco partners want to sell their customer system integration services for small and medium sized businesses,Cisco
